red ,Title,Flair,Submission url,Actual url,Submitter,Author,Permalink,Score,Created,Uploaded (UTC),Countries/-balls featured,Dates,Format,Topics,Summary,Notable Quotes,Full transcript,Notes
t3_1806o8,The Republic of Cascadia,redditormade,http://i.imgur.com/1zSfi3I.png,,Biscotti_Manicotti,Biscotti_Manicotti,http://www.reddit.com/r/polandball/comments/1806o8/the_republic_of_cascadia/,220,1360167958,2013-02-06 16:25:58,"USA, Canada, British Columbia, Washington, Oregon, Idaho",,single-panel,cascadia,,,,
t3_180hby,Do Do-Do-Do,berndmade,http://i.imgur.com/0Eotz9A.jpg,,Jagodka,,http://www.reddit.com/r/polandball/comments/180hby/do_dododo/,124,1360176627,2013-02-06 18:50:27,"Poland, Kazakhstan, USSR",,"multi-panel, 2",tetris,,,,
t3_181ge5,Always prepared,berndmade,http://i.imgur.com/JibKUx6.png,,Jagodka,,http://www.reddit.com/r/polandball/comments/181ge5/always_prepared/,173,1360204368,2013-02-07 02:32:48,"Germany, Turkey, Nazi Germany, France, UK, Poland, Ukraine",,"multi-panel, 6","ukraine loves salo, remove kebab",,,,
t3_182rhi,International cuisine - an old dish freshly served,redditormade,http://i.imgur.com/idntzMN.png,,littoral,littoral,http://www.reddit.com/r/polandball/comments/182rhi/international_cuisine_an_old_dish_freshly_served/,101,1360260365,2013-02-07 18:06:05,"Hungary, Turkey",,single-panel,remove kebab,,,,
t3_183bf9,Iceland feels of bad,berndmade,http://imgur.com/YDN9xmQ,,TheReasonableCamel,,http://www.reddit.com/r/polandball/comments/183bf9/iceland_feels_of_bad/,199,1360275504,2013-02-07 22:18:24,"Iceland, Germany, Russia, UK",,"multi-panel, 4",Eyjafjallajokull,,,,
t3_183i8e,Somewhere out there...,redditormade,http://i.imgur.com/wHa68mP.png,,AaronC14,AaronC14,http://www.reddit.com/r/polandball/comments/183i8e/somewhere_out_there/,892,1360280767,2013-02-07 23:46:07,"Poland, Russia, Germany",,,,,,,
t3_184vcz,Germany and Russia in WWI,redditormade,http://i.imgur.com/0GS1sZ7.png,,Kilkun,Kilkun,http://www.reddit.com/r/polandball/comments/184vcz/germany_and_russia_in_wwi/,132,1360337922,2013-02-08 15:38:42,"Austria-Hungary, Serbia, Russia, German Empire",,"multi-panel, 7",ww1,,,,
t3_184x3k,What happens when you find out there are girls on here,berndmade,http://i.imgur.com/qCouYA3.png,,YouHaveTakenItTooFar,,http://www.reddit.com/r/polandball/comments/184x3k/what_happens_when_you_find_out_there_are_girls_on/,322,1360339481,2013-02-08 16:04:41,"USA, Poland, Germany, UK, Russia",,"multi-panel, 7",gender,,,,
t3_185mpc,True neutral,deleted,http://i.imgur.com/ybrseS4.jpg,,Medibee,,http://www.reddit.com/r/polandball/comments/185mpc/true_neutral/,15,1360359990,2013-02-08 21:46:30,"Switzerland, Poland",,"multi-panel, 4",Polanski,,,,"Poland is upside down, deleted, fixed in t3_185xx6"
t3_185p6s,Ireland in WW2,redditormade,http://i.imgur.com/zzhkcgk.png,,Rindfleisch,Rindfleisch,http://www.reddit.com/r/polandball/comments/185p6s/ireland_in_ww2/,196,1360361855,2013-02-08 22:17:35,"Ireland, UK, Nazi Germany",,"multi-panel, 3","ww2, irish neutrality in ww2",,,,
t3_185xx6,True neutral [FIXED],berndmade,http://i.imgur.com/BVC5roQ.png,,Medibee,,http://www.reddit.com/r/polandball/comments/185xx6/true_neutral_fixed/,105,1360369280,2013-02-09 00:21:20,"Switzerland, Poland",,"multi-panel, 4",Polanski,,,,
t3_185yhd,The beginning of WW I,berndmade,http://i.imgur.com/IiBLnIm.jpg,,gobohobo,,http://www.reddit.com/r/polandball/comments/185yhd/the_beginning_of_ww_i/,38,1360369608,2013-02-09 00:26:48,"German Empire, Austria-Hungary, UK",,"multi-panel, 5",ww1,,,,
t3_185z4n,Rule Britannia!,berndmade,http://i.imgur.com/Sd7rsYj.png,,koleye,,http://www.reddit.com/r/polandball/comments/185z4n/rule_britannia/,858,1360370136,2013-02-09 00:35:36,"uk, france, spain, usa, australia",,,past empires,,,,
t3_186s0n,Aligment,redditormade,http://imgur.com/dhKP9F5,,cyaspy,cyaspy,http://www.reddit.com/r/polandball/comments/186s0n/aligment/,320,1360407229,2013-02-09 10:53:49,"sweden, uk, usa, poland, switzerland, china, russia, austria, north korea",,,aligment,,,,
t3_1878le,Brief History of Israel,redditormade,http://imgur.com/k1OsX4c,,cyaspy,cyaspy,http://www.reddit.com/r/polandball/comments/1878le/brief_history_of_israel/,150,1360432380,2013-02-09 17:53:00,israel,,,"template, brief history of",,"oi vey, oy vei",,
t3_187cw1,USA's ancestry,redditormade,http://i.imgur.com/ENpPLT7.png,,motoy,motoy,http://www.reddit.com/r/polandball/comments/187cw1/usas_ancestry/,557,1360436346,2013-02-09 18:59:06,"uk, usa, germany",,,,,,,
t3_187j89,Brasil is of neologism.,deleted,http://i.imgur.com/MHwEiIU.png,,jinnyjuice,jinnyjuice,http://www.reddit.com/r/polandball/comments/187j89/brasil_is_of_neologism/,16,1360441879,2013-02-09 20:31:19,"brazil, portugal",,,huehue,,,,"circle tool, possibly deleted"
t3_187v96,The World According to Toronto,redditormade,http://i.imgur.com/WuJvuOi.jpg,,jackinthecrapper,jackinthecrapper,http://www.reddit.com/r/polandball/comments/187v96/the_world_according_to_toronto/,175,1360453017,2013-02-09 23:36:57,toronto,,single-panel,world according to,,,,
t3_188a5q,Scotland has enough.,redditormade,http://i.imgur.com/J8PMilB.png,,TheClump,TheClump,http://www.reddit.com/r/polandball/comments/188a5q/scotland_has_enough/,86,1360467834,2013-02-10 03:43:54,"england, scotland",,,,,,,
t3_188boc,WW2: How it (not) really was won,redditormade,http://i.imgur.com/uttlUpQ.png,,Kilkun,Kilkun,http://www.reddit.com/r/polandball/comments/188boc/ww2_how_it_not_really_was_won/,35,1360469377,2013-02-10 04:09:37,"nazi germany, usa, switzerland",,,switzerland has gold,,,,
t3_188ncg,The Napoleonic Wars (Parts 1-5),redditormade,http://imgur.com/a/Su6C1#sut8Vrd,,AaronC14,AaronC14,http://www.reddit.com/r/polandball/comments/188ncg/the_napoleonic_wars_parts_15/,306,1360485123,2013-02-10 08:32:03,"France, UK, Prussia, Portugal, Spain, Russia, Austria, Sweden, Netherlands, Ottoman Empire, Poland",,,,,,,
t3_188smp,Sino-American Relations,redditormade,http://imgur.com/IfgGYdd,,AngryJellyfish,AngryJellyfish,http://www.reddit.com/r/polandball/comments/188smp/sinoamerican_relations/,228,1360498200,2013-02-10 12:10:00,,,,,,,,
t3_189c7k,Mmm Kielbasa,berndmade,http://imgur.com/Q5yEfeP,,TheReasonableCamel,,http://www.reddit.com/r/polandball/comments/189c7k/mmm_kielbasa/,150,1360523571,2013-02-10 19:12:51,"Sweden, EU, Poland",,"multi-panel, 4",bad meat,,,,
t3_189rkf,"The ""Euromoney"" chain of profit",redditormade,http://i.imgur.com/XmFnEaM.png,,Pirate_Archer,Pirate_Archer,http://www.reddit.com/r/polandball/comments/189rkf/the_euromoney_chain_of_profit/,227,1360536468,2013-02-10 22:47:48,"Germany, Portugal",,single-panel,eurozone crisis,,,,
t3_189xke,Flair,redditormade,http://i.imgur.com/J6FC5rb.png,,Medibee,Medibee,http://www.reddit.com/r/polandball/comments/189xke/flair/,92,1360541499,2013-02-11 00:11:39,"Cuba, Moravia, Northern Ireland, Singapore, China, Brazil, Poland, USA",,,"meta, flair results",,,,
t3_18aah4,Malaysia can into Stars and Stripes.,berndmade,http://i.imgur.com/Vb1by34.png,,koleye,,http://www.reddit.com/r/polandball/comments/18aah4/malaysia_can_into_stars_and_stripes/,109,1360551881,2013-02-11 03:04:41,,,,,,,,
t3_18aas0,Several templates for everyone to use.,berndmade,http://imgur.com/a/fGsOQ#2,,koleye,,http://www.reddit.com/r/polandball/comments/18aas0/several_templates_for_everyone_to_use/,92,1360552126,2013-02-11 03:08:46,,,,,,,,
t3_18bqo8,World War One summary Part 1,berndmade,http://i.imgur.com/cqESWSC.png,,Kilkun,,http://www.reddit.com/r/polandball/comments/18bqo8/world_war_one_summary_part_1/,123,1360611473,2013-02-11 19:37:53,,,,,,,,
t3_18bsa5,The Birth of Uruguay,berndmade,http://i.imgur.com/OWZvS2n.png,,Rift28,,http://www.reddit.com/r/polandball/comments/18bsa5/the_birth_of_uruguay/,79,1360612708,2013-02-11 19:58:28,"Empire of Brazil, Rio Grande do Sul, Brazil's states, Uruguay",,,Independence of Uruguay,,,,
t3_18bukl,The Pinipality of Sealand's eternal struggle.,redditormade,http://i.imgur.com/pD9Zkvl.png,,TheClump,TheClump,http://www.reddit.com/r/polandball/comments/18bukl/the_pinipality_of_sealands_eternal_struggle/,3,1360614530,2013-02-11 20:28:50,"sealand, england, eu, un",,"multi-panel, 4",sealand recognition,,,,presumably removed for maymay face
t3_18c5gl,History of Brazil [long version],redditormade,http://i.imgur.com/RVA403d.png,,rowt,rowt,http://www.reddit.com/r/polandball/comments/18c5gl/history_of_brazil_long_version/,408,1360622568,2013-02-11 22:42:48,"brazil, portugal, 7-ball, 8-ball",,"multi-panel, 15",history of brazil,,,,
t3_18cexy,Relocation Lottery.,redditormade,http://i.imgur.com/tucciRh.png,,pax-romana,pax-romana,http://www.reddit.com/r/polandball/comments/18cexy/relocation_lottery/,194,1360629828,2013-02-12 00:43:48,"UK, England, Ireland, Scotland, Australia",,"multi-panel, 4",Australia penal colony,,,,"hair, facial hair"
t3_18cgay,Polandball: Master Chef Edition.,redditormade,http://i.imgur.com/b5XcoJT.png,,pax-romana,pax-romana,http://www.reddit.com/r/polandball/comments/18cgay/polandball_master_chef_edition/,328,1360630894,2013-02-12 01:01:34,"Ireland, Sweden, UK, France, Poland",2013,"multi-panel, 2",horse meat scandal,,,,more facial hair
t3_18dd7z,Most of earth can into metric system.,redditormade,http://i.imgur.com/Ebtk0Js.png,,Medibee,Medibee,http://www.reddit.com/r/polandball/comments/18dd7z/most_of_earth_can_into_metric_system/,314,1360664012,2013-02-12 10:13:32,"Earth, USA, Liberia, Burma",,"multi-panel, 4",metric system,,,,
t3_18djrl,Netherlands meets some new friends for 420.,redditormade,http://imgur.com/tlwOnnA,,97nachotv,97nachotv,http://www.reddit.com/r/polandball/comments/18djrl/netherlands_meets_some_new_friends_for_420/,74,1360676150,2013-02-12 13:35:50,"Colorado, Netherlands, Washington",2012,single-panel,legalization of marijuana,,,,
t3_18dynf,Principality Of Sealand's Eternal Struggle [Fixed.],redditormade,http://i.imgur.com/idr0aWz.png,,TheClump,TheClump,http://www.reddit.com/r/polandball/comments/18dynf/principality_of_sealands_eternal_struggle_fixed/,2,1360690907,2013-02-12 17:41:47,"sealand, england, eu, un",,"multi-panel, 4",sealand recognition,,,,deleted again for maymay face
t3_18e9t8,European microstates club,redditormade,http://i.imgur.com/m30D3i5.png,,MartelFirst,MartelFirst,http://www.reddit.com/r/polandball/comments/18e9t8/european_microstates_club/,639,1360699819,2013-02-12 20:10:19,"Andorra, Monaco, Vatican, San Marino, Liechtenstein, Malta, Luxembourg, Spain, France, Italy, Switzerland, Austria",,"multi-panel, 10",microstates,,,,spawned a mini
t3_18enzs,Poor North Korea...,redditormade,http://imgur.com/JFa6kRQ,,naturalexponent,naturalexponent,http://www.reddit.com/r/polandball/comments/18enzs/poor_north_korea/,163,1360710566,2013-02-12 23:09:26,"north korea, south korea, usa, china",,"multi-panel, 3","north korean aid, north korean nuclear program",,,,
t3_18ew94,International Mathletics,redditormade,http://imgur.com/zBfTSgR,,brain4breakfast,brain4breakfast,http://www.reddit.com/r/polandball/comments/18ew94/international_mathletics/,119,1360717188,2013-02-13 00:59:48,"Poland, Kazakhstan, Singapore, Israel, Nepal",,single-panel,"Mathletics, flags",,,,
t3_18f4ka,The US does not like Communism.,redditormade,http://i.imgur.com/zbUYyJR.png,,xkimball,xkimball,http://www.reddit.com/r/polandball/comments/18f4ka/the_us_does_not_like_communism/,58,1360723584,2013-02-13 02:46:24,"usa, ussr",,single-panel,cold war,,,,
t3_18gwci,"Here is little gamings for you, /r/polandball!",redditormade,http://i.imgur.com/3DmAMcW.png,,rowt,rowt,http://www.reddit.com/r/polandball/comments/18gwci/here_is_little_gamings_for_you_rpolandball/,270,1360790617,2013-02-13 21:23:37,"chad, romania, moldavia, andorra, qatar, bahrain, benin, guinea-bissau, nicaragua, honduras, el salvador, poland, indonesia, monaco, singapore, egypt, iraq, yemen, syria, reichtangle, lithuania, myanmar, bolivia, latvia, austria, tahiti, luxembourg, netherlands, costa rica, thailand, cuba, puerto rico, ireland, ivory coast, mali, guinea, liberia, USA, malaysia, mexico, italy, australia, new zealand, palestine, jordan, sudan, south sudan, venezuela, ecuador, colombia, norway, iceland, denmark, sweden, finland, estonia",,,game of guessing the countries,,,,
t3_18hof8,A Brief History of The Falklands/Las Malvinas,redditormade,http://imgur.com/BCBMrzo,,brain4breakfast,brain4breakfast,http://www.reddit.com/r/polandball/comments/18hof8/a_brief_history_of_the_falklandslas_malvinas/,199,1360812089,2013-02-14 03:21:29,"argentina, uk, france, spain",,,"malvinas, falklands",,,,
t3_18hoo5,The Bay of Pigs Invasion,redditormade,http://i.imgur.com/ug8FBvb.png,,xkimball,xkimball,http://www.reddit.com/r/polandball/comments/18hoo5/the_bay_of_pigs_invasion/,95,1360812292,2013-02-14 03:24:52,"usa, cuba",,single-panel,,,,,
t3_18hp0u,U.S. Borders,redditormade,http://imgur.com/eLzaG8A,,97nachotv,97nachotv,http://www.reddit.com/r/polandball/comments/18hp0u/us_borders/,194,1360812563,2013-02-14 03:29:23,"canada, usa, mexico",,single-panel,borders,,,,
t3_18hq2m,Merica and Sealand,berndmade,http://imgur.com/k1eYbGB,,97nachotv,,http://www.reddit.com/r/polandball/comments/18hq2m/merica_and_sealand/,112,1360813409,2013-02-14 03:43:29,"usa, sealand",,single-panel,,,,,
t3_18ixbt,Forever Estonia,redditormade,http://i.imgur.com/aSeQacp.png?1,,AaronC14,AaronC14,http://www.reddit.com/r/polandball/comments/18ixbt/forever_estonia/,417,1360863847,2013-02-14 17:44:07,"Estonia, Sweden, Finland",,,,,,,
t3_18j1jk,Portugal tries his luck finding a Valentine,redditormade,http://i.imgur.com/vDWHGOa.png,,Pirate_Archer,Pirate_Archer,http://www.reddit.com/r/polandball/comments/18j1jk/portugal_tries_his_luck_finding_a_valentine/,146,1360866766,2013-02-14 18:32:46,,,,,,,,
t3_18jg2c,The Prinicipality Of Sealand's Eternal Struggle [FIXED],redditormade,http://i.imgur.com/f5URsYO.png,,TheClump,TheClump,http://www.reddit.com/r/polandball/comments/18jg2c/the_prinicipality_of_sealands_eternal_struggle/,6,1360877335,2013-02-14 21:28:55,"sealand, england, eu, un",,"multi-panel, 4",sealand recognition,,,,"deleted yet again, for eyebrow"
t3_18ji0m,The Prinicipality Of Sealand's Eternal Struggle [FIXED],redditormade,http://imgur.com/cLe5o28,,TheClump,TheClump,http://www.reddit.com/r/polandball/comments/18ji0m/the_prinicipality_of_sealands_eternal_struggle/,129,1360878734,2013-02-14 21:52:14,"sealand, england, eu, un",,"multi-panel, 4",sealand recognition,,,,
t3_18k8r2,Party Hard,berndmade,http://i.imgur.com/VjUrGqE.gif,,koleye,,http://www.reddit.com/r/polandball/comments/18k8r2/party_hard/,203,1360900463,2013-02-15 03:54:23,"sweden, sami",,"multi-panel, 4",psychedelic sami,,,,repost of w7ir3 and qrwm6
t3_18kb7d,Germany can no longer into reich time.,berndmade,http://i.imgur.com/SpjXT5E.png,,koleye,,http://www.reddit.com/r/polandball/comments/18kb7d/germany_can_no_longer_into_reich_time/,311,1360902665,2013-02-15 04:31:05,"france, uk, germany",,,"past empires, colonies",,,,
t3_18l9z3,Russia remembers,redditormade,http://i.imgur.com/bWnz6ob.png,,quicksilver991,quicksilver991,http://www.reddit.com/r/polandball/comments/18l9z3/russia_remembers/,189,1360950899,2013-02-15 17:54:59,"japan, russia",,"multi-panel, 5, template","classroom notes template, kuril islands, battle of tsushima strait",,,,
t3_18le6a,A normal day in Russia,redditormade,http://i.imgur.com/yktk4Ti.png,,Rift28,Rift28,http://www.reddit.com/r/polandball/comments/18le6a/a_normal_day_in_russia/,152,1360954421,2013-02-15 18:53:41,"Russia, Armenia, USA",,,chelyabinsk meteor,,,,
t3_18liu8,Micro States Club's newest member?,redditormade,http://i.imgur.com/0GG3xak.png,,CupBeEmpty,CupBeEmpty,http://www.reddit.com/r/polandball/comments/18liu8/micro_states_clubs_newest_member/,67,1360958461,2013-02-15 20:01:01,"Rhode Island, Andorra, Luxembourg, Delaware, Connecticut, Washington D.C.",,"multi-panel, 5",,Rhode Island can't join the microstates club because it is too big,"Washington D.C., ""Cannot into state, cannot into voting, cannot into sovereeignty.""",,
t3_18lur7,Finnish problems,redditormade,http://imgur.com/2jrII8E,,Albiinopanda609,Albiinopanda609,http://www.reddit.com/r/polandball/comments/18lur7/finnish_problems/,163,1360968623,2013-02-15 22:50:23,"finland, estonia, eu, norway, denmark, spain, greece, russia, poland, åland",,"multi-panel, 11, template",country is pissed off and starts old war template,,,,
t3_18mbqi,Czech Republic and Slovakia cannot into getting over break up.,redditormade,http://i.imgur.com/oesn9xM.png,,xkimball,xkimball,http://www.reddit.com/r/polandball/comments/18mbqi/czech_republic_and_slovakia_cannot_into_getting/,188,1360985280,2013-02-16 03:28:00,"czech republic, slovakia, czechoslovakia",,single-panel,,,,,
t3_18mm44,Ukrainian Problems,redditormade,http://i.imgur.com/lOuOySf.png,,Vexillae,Vexillae,http://www.reddit.com/r/polandball/comments/18mm44/ukrainian_problems/,146,1360997776,2013-02-16 06:56:16,"ukraine, slovakia, eu, slovenia, croatia, bulgaria, uk, nato, poland, turkey",,"multi-panel, 12, template",country is pissed off and starts old war template,,,,
t3_18mui2,Smolensk stuff,berndmade,http://i.imgur.com/vGik9Rp.png,,Yellowone1,,http://www.reddit.com/r/polandball/comments/18mui2/smolensk_stuff/,277,1361015193,2013-02-16 11:46:33,"russia, belarus",,"multi-panel, 5, template",classroom notes template,,,,
t3_18mv0c,Kosovo cannot into independence,berndmade,http://i.imgur.com/NDrXq8L.png,,reaper_13,,http://www.reddit.com/r/polandball/comments/18mv0c/kosovo_cannot_into_independence/,147,1361016460,2013-02-16 12:07:40,,,,,,,,
t3_18nv6e,Pick on your own size.,redditormade,http://i.imgur.com/2MImlhh.png,,Rolyzage,Rolyzage,http://www.reddit.com/r/polandball/comments/18nv6e/pick_on_your_own_size/,198,1361057382,2013-02-16 23:29:42,"usa, russia, vatican",,,,,,,
t3_18nznm,Where is of ukraine?,redditormade,http://i.imgur.com/8Gdfo0Z.png,,Medibee,Medibee,http://www.reddit.com/r/polandball/comments/18nznm/where_is_of_ukraine/,174,1361061761,2013-02-17 00:42:41,"poland, ukraine, estonia, german empire",,"multi-panel, 7",flags,,,,
t3_18obth,Irish History[fixed],berndmade,http://i.imgur.com/fkMDrbG.png,,Jagodka,,http://www.reddit.com/r/polandball/comments/18obth/irish_historyfixed/,167,1361073885,2013-02-17 04:04:45,"ireland, england",,"multi-panel, 3",ireland cannot into stronk,,,,colours on Irish flag are reversed
t3_18p0pr,Chernobyl nuclear disaster,redditormade,http://i.imgur.com/kg4qga5.png,,Medibee,Medibee,http://www.reddit.com/r/polandball/comments/18p0pr/chernobyl_nuclear_disaster/,258,1361116530,2013-02-17 15:55:30,"ukraine, ukrainian ssr, belarus",1986,"multi-panel, 3",chernobyl,,,,
t3_18p988,NYC Immigration,redditormade,http://i.imgur.com/qT8yLCC.png,,Medibee,Medibee,http://www.reddit.com/r/polandball/comments/18p988/nyc_immigration/,158,1361125848,2013-02-17 18:30:48,"NYC, poland, china, ireland, italy, israel",,"multi-panel, 3",immigration,,,,
t3_18q2y1,A match made in heaven.,redditormade,http://i.imgur.com/kjv7N7h.png,,CupBeEmpty,CupBeEmpty,http://www.reddit.com/r/polandball/comments/18q2y1/a_match_made_in_heaven/,282,1361152012,2013-02-18 01:46:52,"Poland, Germany, France, Ohio, Nepal",,"multi-panel, 3",flag shape,Ohio and Nepal fall in love.,,,
t3_18q4yp,Poland will triple money,berndmade,http://i.imgur.com/FtbFGho.png,,Medibee,,http://www.reddit.com/r/polandball/comments/18q4yp/poland_will_triple_money/,226,1361153928,2013-02-18 02:18:48,"poland, turkey, greece, germany",,"multi-panel, 26",greece makes money,Greece runs a casino.,,,
t3_18rask,Notes and winter war.,redditormade,http://imgur.com/2yEDzNH,,Albiinopanda609,Albiinopanda609,http://www.reddit.com/r/polandball/comments/18rask/notes_and_winter_war/,180,1361206510,2013-02-18 16:55:10,"finland, russia",,"multi-panel, 5, template","classroom notes template, winter war, karelia",,,,
t3_18rjgr,"France, Germany, and box",berndmade,http://i.imgur.com/wVrhFQQ.png,,batmaaang,,http://www.reddit.com/r/polandball/comments/18rjgr/france_germany_and_box/,162,1361213297,2013-02-18 18:48:17,"france, germany",,"multi-panel, 4",alsace-lorraine,,germany you cannot the box,- Germany you are carry a lot of boxes. I will help you. - oh no - Germany you cannot the box,
t3_18rli0,Space can into russia,redditormade,http://i.imgur.com/lWjsNC9.jpg,,Fezzi,Fezzi,http://www.reddit.com/r/polandball/comments/18rli0/space_can_into_russia/,798,1361214852,2013-02-18 19:14:12,"usa, china, russia, kazakhstan",,"multi-panel, 4",chelyabinsk meteor,,"""russia no need to go up space"" ""cos space go to russia"" ""ouch""",,
t3_18rr58,italy is of feeling sick,redditormade,http://i.imgur.com/GiaUhGQ.png,,Fezzi,Fezzi,http://www.reddit.com/r/polandball/comments/18rr58/italy_is_of_feeling_sick/,198,1361219179,2013-02-18 20:26:19,"italy, france, vatican",,"multi-panel, 3",,,,,
t3_18rrm5,looking a gift horse in the mouth,redditormade,http://i.imgur.com/SSls1KJ.png,,74159637895123,74159637895123,http://www.reddit.com/r/polandball/comments/18rrm5/looking_a_gift_horse_in_the_mouth/,331,1361219542,2013-02-18 20:32:22,"Greece, Portugal, Ireland, Germany, USSR, ",,,Financial Crisis,,,,
t3_18t2hr,With our powers combined...,redditormade,http://i.imgur.com/5SM21l2.jpg,,Deathwave88,Deathwave88,http://www.reddit.com/r/polandball/comments/18t2hr/with_our_powers_combined/,132,1361258843,2013-02-19 07:27:23,,,,,,,,
t3_18t6mz,USA launches missile,berndmade,http://i.imgur.com/jVhVent.jpg,,reaper_13,,http://www.reddit.com/r/polandball/comments/18t6mz/usa_launches_missile/,1240,1361265676,2013-02-19 09:21:16,"usa, russia, china, north korea, poland, iran, canada",,"multi-panel, 14",usa's enemies,,,,
t3_18tgjd,History of the Netherlands [tl;dr],redditormade,http://i.imgur.com/HGsGpSE.png,,rakuprime,rakuprime,http://www.reddit.com/r/polandball/comments/18tgjd/history_of_the_netherlands_tldr/,339,1361283348,2013-02-19 14:15:48,netherlands,,"multi-panel, 5","land reclamation in the netherlands, polders",,,,
t3_18u1e7,Usual Belarusian-Lithuanian thread,berndmade,http://imgur.com/p1HboR6,,Yellowone1,,http://www.reddit.com/r/polandball/comments/18u1e7/usual_belarusianlithuanian_thread/,127,1361301614,2013-02-19 19:20:14,"Grand Duchy of Lithuania, Lithuania, Belarus",,single-panel,"chan happenings, country ancestors",,,,
t3_18ubab,Scotland cannot into economic security.,berndmade,http://i.imgur.com/tUUmSU0.png,,mushroomchow,,http://www.reddit.com/r/polandball/comments/18ubab/scotland_cannot_into_economic_security/,414,1361309083,2013-02-19 21:24:43,"uk, scotland, wales, eu, greece",,"multi-panel, 8","scottish independence, eurozone crisis",,,,
t3_18upyy,Not need of stupid coasts,redditormade,http://imgur.com/a/HWH6D,,Obraka,Obraka,http://www.reddit.com/r/polandball/comments/18upyy/not_need_of_stupid_coasts/,108,1361320042,2013-02-20 00:27:22,"Belgium, UK, Denmark, France, Estonia, Bulgaria, Cyprus, Spain, Italy, Poland, Finland, Austria, Slovakia, Czech Republic, Hungary, Germany, Portugal, Latvia, Ireland, Netherlands, Slovenia, Estonia, Greece, Romania, Austria-Hungary",,multi-panel,Austria-Hungary reborn,,,,
t3_18utod,A Short History of the United States of America,redditormade,http://i.imgur.com/Aq6UieO.jpg,,koleye,koleye,http://www.reddit.com/r/polandball/comments/18utod/a_short_history_of_the_united_states_of_america/,169,1361322946,2013-02-20 01:15:46,"USA, UK",,,,,,,
t3_18vn9k,A young nation's struggle for international well-being.,redditormade,http://i.imgur.com/6oEVAyz.png,,intredasted,intredasted,http://www.reddit.com/r/polandball/comments/18vn9k/a_young_nations_struggle_for_international/,233,1361352968,2013-02-20 09:36:08,"Slovakia, Czechoslovakia, Scotland, UK, Wales, Hungary, Finland, Austria-Hungary",,,,,,,
t3_18vtlb,Netherlands has an idea (1/2),redditormade,http://i.imgur.com/Ar8t1vt.png,,Gryningen,Gryningen,http://www.reddit.com/r/polandball/comments/18vtlb/netherlands_has_an_idea_12/,342,1361365418,2013-02-20 13:03:38,"netherlands, belgium, germany, france, uk",,"multi-panel, 4","netherlands is stoner, weed tourism",,,,
t3_18vxm4,Netherlands has an idea (2/2),redditormade,http://i.imgur.com/LYFa6PO.png,,Gryningen,Gryningen,http://www.reddit.com/r/polandball/comments/18vxm4/netherlands_has_an_idea_22/,205,1361370691,2013-02-20 14:31:31,"netherlands, germany, uk, france",,"multi-panel, 7","netherlands is stoner, weed tourism",,,,
t3_18wiii,Freedom now!,berndmade,http://i.imgur.com/2BqoLNu.png,,reaper_13,,http://www.reddit.com/r/polandball/comments/18wiii/freedom_now/,210,1361388495,2013-02-20 19:28:15,"India, UK, Vietnam, France, 8-ball, Algeria",,"multi-panel, 6","independence or lack thereof, colonialism, post-colonialism, france always surrenders
",,,,
t3_18wlcs,Kawaii,redditormade,http://i.imgur.com/nbJAcRM.png,,rowt,rowt,http://www.reddit.com/r/polandball/comments/18wlcs/kawaii/,475,1361390619,2013-02-20 20:03:39,"poland, germany",,"multi-panel, 4",kawaii,,,,
t3_18ww19,Apply sunscreen regularly,redditormade,http://i.imgur.com/MBr9b2g.png,,SchindetNemo,SchindetNemo,http://www.reddit.com/r/polandball/comments/18ww19/apply_sunscreen_regularly/,409,1361398672,2013-02-20 22:17:52,"Austria, Germany",,,,,,,
t3_18x105,BLANDA UPP!,berndmade,http://i.imgur.com/317e4xW.jpg,,Medibee,,http://www.reddit.com/r/polandball/comments/18x105/blanda_upp/,184,1361402409,2013-02-20 23:20:09,"USA, UK, EU, Brazil, China",,,,,,,
t3_18x2i8,How to have fun: Norwegian style!!,redditormade,http://imgur.com/AN8i1od,,tiptopgolfy,tiptopgolfy,http://www.reddit.com/r/polandball/comments/18x2i8/how_to_have_fun_norwegian_style/,211,1361403569,2013-02-20 23:39:29,Norway,,,,,,,
t3_18y4hm,Japan needs a shrink,berndmade,http://i.imgur.com/JnaO6Y5.png,,reaper_13,,http://www.reddit.com/r/polandball/comments/18y4hm/japan_needs_a_shrink/,197,1361442164,2013-02-21 10:22:44,"Japan, Austria, Switzerland, Germany",,,,,,,
t3_18y7rn,Sorry Ireland,berndmade,http://i.imgur.com/nCPiDd7.png,,Medibee,,http://www.reddit.com/r/polandball/comments/18y7rn/sorry_ireland/,2059,1361448629,2013-02-21 12:10:29,"Ireland, EU, IMF, UK",,"multi-panel, 4","Debts, Misery",,,,
