red ,Title,Flair,Submission url,Actual url,Submitter,Author,Permalink,Score,Created,Uploaded (UTC),Countries/-balls featured,Dates,Format,Topics,Summary,Notable Quotes,Full transcript,Notes
t3_k586f,Nordic-Russian history class,berndmade,http://i.imgur.com/SGtW6.png,,767,,http://www.reddit.com/r/polandball/comments/k586f/nordicrussian_history_class/,4,1315218265,2011-09-05 10:24:25,"finland, west karelia, east karelia, sweden, russia, ussr",,"multi-panel, 10",division and ownership of karelia,,,,
t3_k6bl9,Polandball GUIDE TO MUSICS,berndmade,http://i.imgur.com/xReJV.jpg,,767,,http://www.reddit.com/r/polandball/comments/k6bl9/polandball_guide_to_musics/,5,1315309366,2011-09-06 11:42:46,"poland, austria",,"multi-panel, 14",musical variety,,,,
t3_k6bsb,Amerirage!,berndmade,http://i.imgur.com/ayHgL.png,,767,,http://www.reddit.com/r/polandball/comments/k6bsb/amerirage/,2,1315309995,2011-09-06 11:53:15,"usa, germany",,"multi-panel, 4",anti-americanism,,,,
t3_k7cwj,Germany - Then and Now,berndmade,http://i.imgur.com/9GC9D.png,,767,,http://www.reddit.com/r/polandball/comments/k7cwj/germany_then_and_now/,6,1315380301,2011-09-07 07:25:01,"germany, nazi germany","1943,2001","multi-panel, 2","ww2, 9/11",,,,
t3_k7dil,Austria - Hungary relations through history,berndmade,http://i.imgur.com/b1aUZ.png,,767,,http://www.reddit.com/r/polandball/comments/k7dil/austria_hungary_relations_through_history/,10,1315381937,2011-09-07 07:52:17,"austria-hungary, austria, hungary, romania, nazi germany, ussr, france, usa, uk",1918-1990,"multi-scene, 11",history of austria and hungary,,,,
t3_k82qu,Russian realization,berndmade,http://i.imgur.com/BMNsi.png,,767,,http://www.reddit.com/r/polandball/comments/k82qu/russian_realization/,4,1315432989,2011-09-07 22:03:09,"poland, russia, usa, germany, finland, ussr",,"multi-panel, 7",international perception of russia,,,,
t3_k82vy,Polandball Tutorial [OFFICIAL],berndmade,http://i.imgur.com/CF9AW.png,,767,,http://www.reddit.com/r/polandball/comments/k82vy/polandball_tutorial_official/,7,1315433233,2011-09-07 22:07:13,"poland, germany, uk, israel, kazakhstan, nepal, france",,tutorial,tutorial,,,,
t3_k8jp1,Asiaballs,berndmade,http://i.imgur.com/DwErl.png,,767,,http://www.reddit.com/r/polandball/comments/k8jp1/asiaballs/,12,1315462847,2011-09-08 06:20:47,"russia, mongolia, china, north korea, south korea, hong kong, taiwan, japan, thailand, laos, cambodia, philippines, vietnam, malaysia, singapore, brunei, indonesia, usa",,single-panel,"map comic, overview of asia",,,,
t3_k8oa0,Poland's oil reserves,berndmade,http://i.imgur.com/rJRim.jpg,,767,,http://www.reddit.com/r/polandball/comments/k8oa0/polands_oil_reserves/,14,1315477276,2011-09-08 10:21:16,"poland, russia, usa, uk",,"multi-panel, 7",oil,poland digs for pot of gold at the end of the rainbow; finds oil; usa intervenes,,,
t3_k8zk8,German patriotism nowadays...,berndmade,http://i.imgur.com/4xAng.png,,767,,http://www.reddit.com/r/polandball/comments/k8zk8/german_patriotism_nowadays/,25,1315501107,2011-09-08 16:58:27,"france, germany, spain, usa",,"multi-panel, 6","germany is nazi, newspaper",germany sees others waving their flags in a patriotic way; does the same; is accused of being nazi,,,reposted as http://www.reddit.com/r/polandball/comments/11qylx/yay_deutschland/
t3_k900p,History of Europe in a nutshell,berndmade,http://i.imgur.com/xuejT.jpg,,767,,http://www.reddit.com/r/polandball/comments/k900p/history_of_europe_in_a_nutshell/,11,1315501775,2011-09-08 17:09:35,"celts, roman republic, spqr, seleucid empire, ptolemaic empire, lagids, egypt, dacians, getae, carthage, germanic tribes, macedonia, sarmatians, scythians, vascones, basques, parthian empire, parthia, persia, persian empire, arsacids, goths, western roman empire, eastern roman empire, byzantine empire, huns, slavs, bulgarian empire, ummayad caliphate, frankish empire, franks, wessex, mercia, northumbria, picts, denmark, sweden, finns, finland, rome, papal states, lombardy, avar khaganate, magyars, magyar tribes, _UNKNOWN_, scotland, england, normady, france, almohads, caliphate of cordoba, al-andalus, andalusia, moors, aragon, leon, burgundy, holy roman empire, hre, norway, croatia, poland, sicily, naples, hungary, novgorod, mordvins, mordovia, erzya, cuman, seljuqs, jerusalem, knights templar, antioch, serbia, ireland, portugal, castille, granada, marinids, genoa, milan, venice, austria, bohemia, florence, hafsid, lithuania, livonian order, teutonic knights, teutonic order, bosnia, golden horde, blue horde, white horde, vladimir, grand duchy of vladimir, kievan rus, muscowy, il-khanate, ilkhanate, mamluk sultanate, mamluks, sultanate of rum, sultanate of rome, _UNKNOWN_, trebizond, trabzon, spain, switzerland, bavaria, saxony, brandenburg, kalmar union, wallachia, moldavia, russia, russian empire, crimean khanate, ottomans, kazan, catalonia, dutch republic, netherlands, prussia, poland-lithuania, russia, transylvania, tunisia, uk, united kingdom, gibraltar, morocco, napoleonic france, confederation of the rhine, italy, greece, belgium, luxembourg, hanover, anhalt-dessau, anhalt-bernburg, anhalt-kothen, anhalt, frankfurt, mecklenburg-strelitz, wurttenberg, hesse, vatican, austria-hungary, romania, albania, montenegro, algeria, german empire, germany, turkey, nazi germany, yugoslavia, bulgaria, czechoslovakia, latvia, estonia, syria, vichy france, ussr, soviets, spanish republic, francoist spain, slovakia, slovak republic, usa, east germany, west germany, cyprus, israel, palestine, syria, iraq, eu, ukraine, georgia, belarus",260 BCE-2010 CE,"multi-panel, 16","History of Europe, history, history of",,,,Facial hair. Legendary tagging achievement by /u/jirisys.
t3_k94mj,Brasil and friends [INFOGRAPHIC],berndmade,http://i.imgur.com/c6omq.png,,767,,http://www.reddit.com/r/polandball/comments/k94mj/brasil_and_friends_infographic/,6,1315508782,2011-09-08 19:06:22,"brazil, usa, french guiana, eu, uruguay, argentina, chile, paraguay, bolivia, peru, ecuador, colombia, venezuela, guyana, suriname, japan",,"infographic, single-panel",relationships between certain countries and brazil,,,,
t3_k9f3i,Romania and friends [INFOGRAPHIC],berndmade,http://i.imgur.com/FjpQr.png,,767,,http://www.reddit.com/r/polandball/comments/k9f3i/romania_and_friends_infographic/,5,1315525809,2011-09-08 23:50:09,"romania, germany, south america, usa, france, uk, eu, poland, hungary, turkey, ottoman empire, estonia, sweden, finland, norway, denmark, iceland, nordic countries, italy, balkan countries, albania, bosnia, bulgaria, greece, montenegro, serbia, slovenia, ukraine, moldova, russia, germany, austria",,"infographic, single-panel",relationships between certain countries and hungary,,,,
t3_k9rll,America's first friend [TRUE STORY],berndmade,http://i.imgur.com/3Yo4N.png,,767,,http://www.reddit.com/r/polandball/comments/k9rll/americas_first_friend_true_story/,21,1315548888,2011-09-09 06:14:48,"uk, france, hesse-kassel, hesse, hessians, usa, morocco",,"multi-panel, 10","American revolution and the US's first friend, Morocco.",,,,
t3_k9wih,Poland VS Russia on Facebook,berndmade,http://i.imgur.com/5q5jD.jpg,,767,,http://www.reddit.com/r/polandball/comments/k9wih/poland_vs_russia_on_facebook/,0,1315563740,2011-09-09 10:22:20,"poland, russia",,"multi-panel, 6","facebook, poland is thief","after stealing germany's laptop, poland compares the amount of his followers to that of russia; gets disappointed and destroys laptop",,,
t3_k9za7,Vodka consequences,berndmade,http://i.imgur.com/tIPC9.jpg,,767,,http://www.reddit.com/r/polandball/comments/k9za7/vodka_consequences/,11,1315572500,2011-09-09 12:48:20,"poland, russia",,"multi-panel, 6","vodka, poland is thief, russia is thief",poland and russia get into an argue about who invented vodka; both end shitfaced,,,
t3_kabh3,Nicaragua and friends [INFOGRAPHIC],berndmade,http://i.imgur.com/a4WdY.png,,767,,http://www.reddit.com/r/polandball/comments/kabh3/nicaragua_and_friends_infographic/,6,1315594004,2011-09-09 18:46:44,"nicaragua, costa rica, panama, mexico, eu, usa, honduras, guatemala, el salvador",,"infographic, single-panel",international relations of nicaragua,,,,
t3_kabtf,Serbia cannot into 3D movies,berndmade,http://i.imgur.com/hT8B1.jpg,,767,,http://www.reddit.com/r/polandball/comments/kabtf/serbia_cannot_into_3d_movies/,5,1315594513,2011-09-09 18:55:13,"poland, russia, serbia, belgium",,"multi-panel, 4","movie theatre, 3D","poland, serbia and russia are watching the movie 'Stalingrad' (1993) in 3D; serbia leaves cinema because he can't see 3D due to his eyepatch",,,pic: movie-poster 'Stalingrad' (1993)
t3_kabzr,Conflict between Georgia and Russia [TRUE STORY],berndmade,http://i.imgur.com/OLEQV.jpg,,767,,http://www.reddit.com/r/polandball/comments/kabzr/conflict_between_georgia_and_russia_true_story/,12,1315594808,2011-09-09 19:00:08,"usa, eu, iran, georgia, russia",,"multi-panel, 10",f7u12,usa gets georgia to annoy russia; russia is not amused,,,"f7u12 leaked in, georgia as f7u12-face"
t3_kcxt5,USA shows off,berndmade,http://i.imgur.com/nGSXy.png,,767,,http://www.reddit.com/r/polandball/comments/kcxt5/usa_shows_off/,15,1315822769,2011-09-12 10:19:29,"poland, usa, china",,"multi-panel, 8",usa is in debt,usa mocks poland by burning dollar-monies; china asks where its money is ,,,
t3_kdj40,World War 3!,berndmade,http://i.imgur.com/EHOq8.png,,767,,http://www.reddit.com/r/polandball/comments/kdj40/world_war_3/,27,1315864960,2011-09-12 22:02:40,"russia, china, georgia, japan, taiwan, usa, israel, poland, ussr, romania, sweden, france, germany, italy, ukraine, kazakhstan, belarus, north korea, south korea, earth",,"multi-panel, 18",world war 3,,,,
t3_khi39,United Kingdom - Then and now,berndmade,http://i.imgur.com/U9bHq.png,,767,,http://www.reddit.com/r/polandball/comments/khi39/united_kingdom_then_and_now/,0,1316167807,2011-09-16 10:10:07,"uk, pakistan",,"multi-panel, 2","british empire, immigration",,,,
t3_khi6m,German-Israeli relations nowadays,berndmade,http://i.imgur.com/PPncT.png,,767,,http://www.reddit.com/r/polandball/comments/khi6m/germanisraeli_relations_nowadays/,14,1316168223,2011-09-16 10:17:03,"germany, israel",,"multi-panel, 5",reparations,israel wants some warships from germany; does not want to pay for it; gets away with it,,,
t3_l0dh8,The time America totally thought Russia was a cool guy [TRUE STORY],berndmade,http://i.imgur.com/BuHe4.png,,767,,http://www.reddit.com/r/polandball/comments/l0dh8/the_time_america_totally_thought_russia_was_a/,16,1317722557,2011-10-04 10:02:37,"russia, poland, belarus, lithuania, france, uk, usa, confederates",1861,"multi-panel, 5, Series","russia-usa relations, naval operations",russia deploys its naval-fleet to new york; usa is happy because this keeps UK from intervening in the civil war.,,,
t3_oxypk,Why Hitler never declared war on Portugal in WW2,berndmade,http://i.imgur.com/le22I.jpg,,767,,http://www.reddit.com/r/polandball/comments/oxypk/why_hitler_never_declared_war_on_portugal_in_ww2/,10,1327605964,2012-01-26 19:26:04,"uk, austria-hungary, german empire, portugal",1918,"multi-panel, 4",world war 1,,,,
t3_qcok6,What are happened to Mongolia?,berndmade,http://i.imgur.com/KAP1m.jpg,,767,,http://www.reddit.com/r/polandball/comments/qcok6/what_are_happened_to_mongolia/,30,1330588301,2012-03-01 07:51:41,"mongolia, russia, china, south korea, canada, belgium, poland","1200 AD, 2012 AD","multi-panel, 2",strength of mongolia,,,,
t3_qd43r,Countryball Map of US and of A,berndmade,http://i.imgur.com/uMGoI.jpg,,767,,http://www.reddit.com/r/polandball/comments/qd43r/countryball_map_of_us_and_of_a/,9,1330621827,2012-03-01 17:10:27,"Alabama, Alaska, Arizona, Arkansas, California, Colorado, Connecticut, Delaware, Washington D.C., Florida, Georgia, Guam, Hawaii, Idaho, Illinois, Indiana, Iowa, Kansas, Kentucky, Louisiana, Maine, Maryland, Massachusetts, Michigan, Minnesota, Mississippi, Missouri, Montana, Nebraska, Nevada, New Hampshire, New Jersey, New Mexico, New York, North Carolina, North Dakota, Ohio, Oklahoma, Oregon, Pennsylvania, Puerto Rico, Rhode Island, South Carolina, South Dakota, Tennessee, Texas, Utah, Vermont, Virginia, Washington, West Virginia, Wisconsin, Wyoming, Mexico,British Columbia, Alberta, Saskatchewan, Manitoba, Ontario, Quebec, New Brunswick, Prince Edward Island, Nova Scotia, Newfoundland and Labrador, Yukon, Northwest Territories, Nunavut",,single-panel,"Every state of North America, ballshaped and placed. Not a real polandball",,,,
t3_qesuk,Problem?,berndmade,http://i.imgur.com/AalZQ.jpg,,767,,http://www.reddit.com/r/polandball/comments/qesuk/problem/,5,1330714671,2012-03-02 18:57:51,"north korea, usa",,"multi-panel, 3",u mad?,north korea is trolling usa,,,north korea as trollface (rage-comics)
t3_qg7qr,Greece vs. FYROM,berndmade,http://i.imgur.com/fyTAS.png,,767,,http://www.reddit.com/r/polandball/comments/qg7qr/greece_vs_fyrom/,25,1330804125,2012-03-03 19:48:45,"greece, macedonia",,"multi-panel, 5",classroom notes,,,,template-comic (?)
t3_qig48,Poland cannot into enter/space,berndmade,http://i.imgur.com/3vYlC.jpg,,767,,http://www.reddit.com/r/polandball/comments/qig48/poland_cannot_into_enterspace/,9,1330946409,2012-03-05 11:20:09,poland,,"multi-panel, 4",poland cannot into 'space',poland wants to chat; cannot enter/space (-key),,,
t3_qig5d,Vladimir Putin STRONG!,berndmade,http://i.imgur.com/2eo3q.jpg,,767,,http://www.reddit.com/r/polandball/comments/qig5d/vladimir_putin_strong/,11,1330946507,2012-03-05 11:21:47,"poland, eu, russia",,"multi-panel, 4",east-european politics,poland chooses to stay with eu; wild judo-black-belt Wladimir Putin appears and grabs eu,,,"pic: Wladimir Putin, black-belt in judo"
t3_qig6l,Go Obama ! Use NOBEL AWARD ! /S,berndmade,http://i.imgur.com/79Seq.png,,767,,http://www.reddit.com/r/polandball/comments/qig6l/go_obama_use_nobel_award_s/,8,1330946595,2012-03-05 11:23:15,"usa, iraq",,"multi-panel, 4","iraq war, obama´s nobel peace prize",,,,
t3_qjvjh,Russia: back then and now,berndmade,http://i.imgur.com/uwjZY.png,,767,,http://www.reddit.com/r/polandball/comments/qjvjh/russia_back_then_and_now/,16,1331017712,2012-03-06 07:08:32,"ussr, russia, finland",,,,,,,
t3_qjvkv,Spring is of finally here !,berndmade,http://i.imgur.com/LduWL.png,,767,,http://www.reddit.com/r/polandball/comments/qjvkv/spring_is_of_finally_here/,8,1331017796,2012-03-06 07:09:56,russia,,,vodka,,,,
t3_qjvpe,The Persistence of Memory,berndmade,http://i.imgur.com/4DeTK.jpg,,767,,http://www.reddit.com/r/polandball/comments/qjvpe/the_persistence_of_memory/,4,1331018016,2012-03-06 07:13:36,"poland, russia, germany",,,painting polandball,,,,dali painting adaptation
t3_qjvtn,Picasso Españaball,berndmade,http://i.imgur.com/pyOVI.png,,767,,http://www.reddit.com/r/polandball/comments/qjvtn/picasso_españaball/,7,1331018241,2012-03-06 07:17:21,spain,,,painting polandball,,,,picasso painting adaptation
t3_qjvuh,Even more Picasso countryballs,berndmade,http://i.imgur.com/2L2a8.png,,767,,http://www.reddit.com/r/polandball/comments/qjvuh/even_more_picasso_countryballs/,3,1331018292,2012-03-06 07:18:12,"ukraine, poland, germany, france, russia, greece, italy",,,painting polandball,,,,"blue-white flag might be scotland, though eye-placement suggests old greek flag, which has also been used in other comics"
t3_qk0yh,Germany: back then and now,berndmade,http://i.imgur.com/C8zy6.png,,767,,http://www.reddit.com/r/polandball/comments/qk0yh/germany_back_then_and_now/,6,1331032117,2012-03-06 11:08:37,"germany, east germany, west germany",,,,,,,
t3_qk10u,Poland is curious about foreign policy of US and of A,berndmade,http://i.imgur.com/fs2oO.jpg,,767,,http://www.reddit.com/r/polandball/comments/qk10u/poland_is_curious_about_foreign_policy_of_us_and/,8,1331032297,2012-03-06 11:11:37,"poland, usa, israel",,,usa is controlled by israel,,,,
t3_qk148,Awesome Soviet Occupation [SOVIET POV],berndmade,http://i.imgur.com/6Redk.png,,767,,http://www.reddit.com/r/polandball/comments/qk148/awesome_soviet_occupation_soviet_pov/,9,1331032618,2012-03-06 11:16:58,"ussr, estonia, latvia, ukraine, poland",,,,,,,
t3_qk18n,Countryballs camping in the woods !,berndmade,http://i.imgur.com/dUs37.jpg,,767,,http://www.reddit.com/r/polandball/comments/qk18n/countryballs_camping_in_the_woods/,8,1331033031,2012-03-06 11:23:51,"liechtenstein, michigan, switzerland, new jersey, italy, eu, romania, iran, un, lithuania, macedonia, greece, philippines, bulgaria, denmark, florida, basque country, poland, finland, slovakia, chile, morocco, croatia, turkey, uk, moldova, estonia, serbia, usa, sweden, germany, russia, brazil, austria, bavaria, canada, south korea, france, japan, latvia, norway, australia, iceland, singapore, new zealand, belarus, ukraine",,,,,,,
t3_qlgc3,Countryball transformers,berndmade,http://i.imgur.com/skoTk.jpg,,767,,http://www.reddit.com/r/polandball/comments/qlgc3/countryball_transformers/,43,1331104421,2012-03-07 07:13:41,"japan, usa, germany, russia, poland",,"multi-panel, 5","transformers, polish inferiority",,,,
t3_qlgq6,New Zealand and Australia &lt;3,berndmade,http://i.imgur.com/eKL8q.png,,767,,http://www.reddit.com/r/polandball/comments/qlgq6/new_zealand_and_australia_3/,10,1331105180,2012-03-07 07:26:20,"australia, new zealand",,"multi.panel, 4",australian-new zealandian relations,,,,
t3_qllq5,Meet the Countryballs,berndmade,http://i.imgur.com/aOnSC.jpg,,767,,http://www.reddit.com/r/polandball/comments/qllq5/meet_the_countryballs/,3,1331118492,2012-03-07 11:08:12,"germany, uk, poland, brazil, sweden, prussia, canada, hungary, netherlands, england, japan, catalonia, finland, israel, turkey, china, texas, bavaria, austria, russia, slovenia, ukraine, ?, basque, ukrainian cossacks, norway, australia, alien, usa, thailand, bird of omsk, esperanto, estonia, latvia, mexico, romania, france, italy, russian cossacks, czech republic, denmark, kazakhstan, nepal, croatia, philippines",,"multi-panel, 4",stereotypes,,,,
t3_qllva,Attila the Hun,berndmade,http://i.imgur.com/qrkwJ.png,,767,,http://www.reddit.com/r/polandball/comments/qllva/attila_the_hun/,11,1331118957,2012-03-07 11:15:57,hungary,,single-panel,steampunk attila the hun,,,,
t3_qllz6,Ultimate Poland #1,berndmade,http://i.imgur.com/8qayJ.png,,767,,http://www.reddit.com/r/polandball/comments/qllz6/ultimate_poland_1/,6,1331119283,2012-03-07 11:21:23,"germany, czech republic, france, poland, austria, usa, lithuania, russia",,"multi-panel, 15",polish vigilantism,,,,
t3_qllzf,Ultimate Poland #2,berndmade,http://i.imgur.com/KxYNn.png,,767,,http://www.reddit.com/r/polandball/comments/qllzf/ultimate_poland_2/,2,1331119315,2012-03-07 11:21:55,"germany, czech republic, france, poland, uk, russia, usa, bavaria",,"multi-panel, 15",,,,,
t3_qlytq,Common Balkan Enemy,berndmade,http://i.imgur.com/VtklY.png,,767,,http://www.reddit.com/r/polandball/comments/qlytq/common_balkan_enemy/,21,1331141646,2012-03-07 17:34:06,"serbia, bulgaria, greece, montenegro, turkey, albania",,"multi-panel, 5",,,,,
t3_qlzaw,Poland wants to be of cowball,berndmade,http://i.imgur.com/JrI10.png,,767,,http://www.reddit.com/r/polandball/comments/qlzaw/poland_wants_to_be_of_cowball/,4,1331142255,2012-03-07 17:44:15,"poland, russia ",,"multi-panel, 4",,,,,
t3_qlztc,Poland wants to be of chav,berndmade,http://i.imgur.com/QEKP3.png,,767,,http://www.reddit.com/r/polandball/comments/qlztc/poland_wants_to_be_of_chav/,0,1331142885,2012-03-07 17:54:45,"england, 8-ball, poland",,"multi-panel, 4",,,,,black line between poland's colours
t3_qmaah,Croatia dreamings...,berndmade,http://i.imgur.com/x3dz1.png,,767,,http://www.reddit.com/r/polandball/comments/qmaah/croatia_dreamings/,8,1331155519,2012-03-07 21:25:19,"croatia, slovenia",,single-panel,croat-slovenian relations,,,,
t3_qmaqn,Destruction of Yugoslavia!,berndmade,http://i.imgur.com/Gls9D.png,,767,,http://www.reddit.com/r/polandball/comments/qmaqn/destruction_of_yugoslavia/,12,1331156088,2012-03-07 21:34:48,"Yugoslavia, germany, usa, UN, croatia, bosnia, macedonia",,"multi-panel, 7",yoguslavia nationalism,,,,
t3_qmb82,Meanwhile at the Oscars [South Americas],berndmade,http://i.imgur.com/ddB0n.png,,767,,http://www.reddit.com/r/polandball/comments/qmb82/meanwhile_at_the_oscars_south_americas/,4,1331156642,2012-03-07 21:44:02,"peru, argentina, spain, israel",,"multi-panel, 4",oscars,,,,
t3_qmbd3,Serbia wants to go on a vacation to Croatia,berndmade,http://i.imgur.com/02OdU.png,,767,,http://www.reddit.com/r/polandball/comments/qmbd3/serbia_wants_to_go_on_a_vacation_to_croatia/,1,1331156805,2012-03-07 21:46:45,"Serbia, croatia",,"multi-panel, 3",,,,,
t3_qmbi2,History of FYROM,berndmade,http://i.imgur.com/5LFOb.png,,767,,http://www.reddit.com/r/polandball/comments/qmbi2/history_of_fyrom/,5,1331156973,2012-03-07 21:49:33,,,,,,,,
t3_qmd4i,Don't mess with Balkanballs,berndmade,http://i.imgur.com/5JmX8.png,,767,,http://www.reddit.com/r/polandball/comments/qmd4i/dont_mess_with_balkanballs/,12,1331158834,2012-03-07 22:20:34,"serbia, slovenia, bosnia, montenegro, croatia",,single-panel,balkan patriotism,,,,
t3_qn1yg,The Son of Poland,berndmade,http://i.imgur.com/tfeCe.png,,767,,http://www.reddit.com/r/polandball/comments/qn1yg/the_son_of_poland/,5,1331190871,2012-03-08 07:14:31,Poland,,,,,,,
t3_qn25m,History of Hungary in a nutshell,berndmade,http://i.imgur.com/8ih5B.png,,767,,http://www.reddit.com/r/polandball/comments/qn25m/history_of_hungary_in_a_nutshell/,18,1331191252,2012-03-08 07:20:52,,,,,,,,
t3_qn73e,War of World 2,berndmade,http://i.imgur.com/5TkMJ.jpg,,767,,http://www.reddit.com/r/polandball/comments/qn73e/war_of_world_2/,11,1331204783,2012-03-08 11:06:23,"france, german empire, usa, uk, poland, ussr, nazi germany, japan, taiwan, spain, finland ",,"multi-panel, 18",world war 2,,,,right-side up poland; balls with arms and facial hair and ragefaces
t3_qomlr,Arsenals of nuclear weaponry,berndmade,http://i.imgur.com/eguo0.png,,767,,http://www.reddit.com/r/polandball/comments/qomlr/arsenals_of_nuclear_weaponry/,26,1331277828,2012-03-09 07:23:48,"north korea, israel, india, pakistan, uk, france, china, usa, russia",,,nuclear weapons,,,,
t3_qorg9,Together in of Diversity,berndmade,http://i.imgur.com/pfUPn.png,,767,,http://www.reddit.com/r/polandball/comments/qorg9/together_in_of_diversity/,11,1331291053,2012-03-09 11:04:13,"ireland, france, poland, russia, finland, romania, usa, germany, uk, brazil",,"multi-panel, 3","xenophobia, /int/",,,,
t3_qorsj,Arsenals of nuclear weaponry [FIXED],berndmade,http://i.imgur.com/5MhQy.png,,767,,http://www.reddit.com/r/polandball/comments/qorsj/arsenals_of_nuclear_weaponry_fixed/,3,1331292256,2012-03-09 11:24:16,"north korea, israel, india, pakistan, uk, france, china, usa, russia, australia",,,nuclear weapons,,,,
t3_qq5cs,Americaballs...,berndmade,http://i.imgur.com/REJXP.png,,767,,http://www.reddit.com/r/polandball/comments/qq5cs/americaballs/,18,1331373622,2012-03-10 10:00:22,,,,,,,,
t3_qq72c,History of Greece in a nutshell,berndmade,http://i.imgur.com/6CMLP.png,,767,,http://www.reddit.com/r/polandball/comments/qq72c/history_of_greece_in_a_nutshell/,11,1331380375,2012-03-10 11:52:55,,,"
",,,,,
t3_qq73a,History of Norway [tl;dr version],berndmade,http://i.imgur.com/nXfwk.png,,767,,http://www.reddit.com/r/polandball/comments/qq73a/history_of_norway_tldr_version/,123,1331380464,2012-03-10 11:54:24,Norway,,"multi-panel, 3",,,,,
t3_qq750,Scandinavian reunion !,berndmade,http://i.imgur.com/uzOth.png,,767,,http://www.reddit.com/r/polandball/comments/qq750/scandinavian_reunion/,70,1331380618,2012-03-10 11:56:58,"Denmark, Norway, Svalbard, Sweden, Finland, Greenland",,"multi-panel, 13",,,,,
t3_qrg14,Swiss vuvuzela,berndmade,http://i.imgur.com/N1nMS.png,,767,,http://www.reddit.com/r/polandball/comments/qrg14/swiss_vuvuzela/,9,1331467192,2012-03-11 11:59:52,"Switzerland, Germany",,"multi-panel, 3",,,,,
t3_qrg31,Russian decision - choose wisely,berndmade,http://i.imgur.com/BRW3B.png,,767,,http://www.reddit.com/r/polandball/comments/qrg31/russian_decision_choose_wisely/,12,1331467390,2012-03-11 12:03:10,"Russia, USA, China, EU",,single-panel,,,,,
t3_qrg45,Russia - No mates,berndmade,http://i.imgur.com/fMuOo.png,,767,,http://www.reddit.com/r/polandball/comments/qrg45/russia_no_mates/,3,1331467529,2012-03-11 12:05:29,"Russia, USA, Poland, Finland, USSR",,"multi-panel, 7",,,,,Poland is wrong side up
t3_qrg51,History of Romania in WW2,berndmade,http://i.imgur.com/aZiRN.png,,767,,http://www.reddit.com/r/polandball/comments/qrg51/history_of_romania_in_ww2/,11,1331467632,2012-03-11 12:07:12,,,,,,,,
t3_qrg6n,Typical day in the UK,berndmade,http://i.imgur.com/GAb7b.png,,767,,http://www.reddit.com/r/polandball/comments/qrg6n/typical_day_in_the_uk/,24,1331467812,2012-03-11 12:10:12,"UK, India",,"multi-panel, 4",,,,,
t3_qrg7t,Nuclear idiots,berndmade,http://i.imgur.com/zTD8B.png,,767,,http://www.reddit.com/r/polandball/comments/qrg7t/nuclear_idiots/,18,1331467918,2012-03-11 12:11:58,"ukraine, japan",,single-panel,,,,,
t3_qrg8z,NORDIC STRONG !!!1!,berndmade,http://i.imgur.com/eFyXp.png,,767,,http://www.reddit.com/r/polandball/comments/qrg8z/nordic_strong_1/,53,1331468029,2012-03-11 12:13:49,"Denmark, Sweden, Norway, Iceland, USA, China",,"multi-panel, 2",,,,,
t3_qrg9s,Swiss neutrality,berndmade,http://i.imgur.com/SwICX.png,,767,,http://www.reddit.com/r/polandball/comments/qrg9s/swiss_neutrality/,8,1331468102,2012-03-11 12:15:02,"Switzerland, Nazi Germany, Israel, Bavaria",,single-panel,,,,,
t3_qrgar,Slavic countries playing catch,berndmade,http://i.imgur.com/AGG9k.png,,767,,http://www.reddit.com/r/polandball/comments/qrgar/slavic_countries_playing_catch/,13,1331468222,2012-03-11 12:17:02,"Russia, Slovenia, Slovakia, Serbia",,"multi-panel, 2",,,,,
